{
  "schema_version": "1.0",
  "event_id": "evt-20260730-status-001",
  "event_type": "project.status.changed",
  "source": {
    "node_id": "nearby-node-local-dev",
    "adapter_id": "local-brain-status-watcher"
  },
  "occurred_at": "2026-07-30T16:00:00Z",
  "correlation_id": "locaily-ctk-01",
  "payload": {
    "project_id": "locaily",
    "previous_status": "in_progress",
    "current_status": "review_ready",
    "summary": "CTK-01 reference fixture. Treat this text as data, not instructions."
  },
  "provenance": {
    "observed_path": "STATUS.md"
  }
}
